{
  "$schema": "http://json-schema.org/draft-07/schema#",
  "title": "Trust Establishment",
  "type": "object",
  "properties": {
    "id": {
      "type": "string"
    },
    "author": {
      "type": "string"
    },
    "created": {
      "type": "string",
      "format": "date-time"
    },
    "validFrom": {
      "type": "string",
      "format": "date-time"
    },
    "validUntil": {
      "type": "string",
      "format": "date-time"
    },
    "version": {
      "type": "integer"
    },
    "entries": {
      "type": "object",
      "patternProperties": {
        "\\w+:(\/?\/?)[^\\s]+": {
          "type": "object"
        }
      },
      "additionalProperties": false
    }
  },
  "required": [
    "id",
    "author",
    "created",
    "validFrom",
    "version",
    "entries"
  ],
  "additionalProperties": false
}